lot,source_url,citations,initial_language,initial_type,http_status,final_url,content_type,html_lang,title,meta_description,h1_count,h1,canonical,canonical_self,meta_robots,x_robots_tag,noindex_detected,hreflang_count,hreflangs,robots_allowed_bingbot,robots_decision,robots_pattern,technical_status,strategic_status,note,fetch_error
MW-BING-AI-CITED-URLS-CANONICAL-INDEXABILITY-QA-013E7,https://www.matchwalls.com/blogs/inspiracion/aprende-a-empapelar-paredes-y-techos-con-calidades-non-woven-vinilicas-y-peel-and-stick,2,ES/default,blog,200,https://www.matchwalls.com/blogs/inspiracion/aprende-a-empapelar-paredes-y-techos-con-calidades-non-woven-vinilicas-y-peel-and-stick,text/html; charset=utf-8,es,Cómo empapelar pared con papel pintado,"Aprende a empapelar paredes y techos con papel pintado Non Woven, Vinílico y Peel and Stick. Consejos y pasos para resultados profesionales.",1,"Aprende a Empapelar Paredes y Techos con Calidades Non Woven, Vinílicas y Peel and Stick",https://www.matchwalls.com/blogs/inspiracion/aprende-a-empapelar-paredes-y-techos-con-calidades-non-woven-vinilicas-y-peel-and-stick,True,,,False,8,"x-default,es,pt,fr,de,it,en,nl",True,allow,/blogs/,VERIFICADO Y CORRECTO,VERIFICADO PERO MEJORABLE,Potentially strategic citable content.,
MW-BING-AI-CITED-URLS-CANONICAL-INDEXABILITY-QA-013E7,https://www.matchwalls.com/en/collections/castellon-wallpaper,2,EN,collection,200,https://www.matchwalls.com/en/collections/castellon-wallpaper,text/html; charset=utf-8,en,Buy Wallpaper Castellón - MatchWalls,Beautify your home in Castellón with wallpapers inspired by the Mediterranean. MatchWalls offers variety and free shipping throughout the province.,1,Castellón Wallpaper,https://www.matchwalls.com/en/collections/castellon-wallpaper,True,,,False,8,"x-default,es,pt,fr,de,it,en,nl",True,allow,/*/collections/,VERIFICADO Y CORRECTO,VERIFICADO PERO MEJORABLE,EN geographic collection cited; validate whether this aligns with geo strategy.,
MW-BING-AI-CITED-URLS-CANONICAL-INDEXABILITY-QA-013E7,https://www.matchwalls.com/pt/pages/como-fazer-medicoes-de-parede,2,PT,page,200,https://www.matchwalls.com/pt/pages/como-fazer-medicoes-de-parede,text/html; charset=utf-8,pt-PT,Como medir paredes – MatchWalls,Aprenda a medir corretamente as suas paredes para um ajuste perfeito do papel de parede.,1,Como medir paredes,https://www.matchwalls.com/pt/pages/como-fazer-medicoes-de-parede,True,,,False,8,"x-default,es,pt,fr,de,it,en,nl",True,allow,/*/pages/,VERIFICADO Y CORRECTO,REQUIERE DECISION HUMANA,PT is outside active priority; decide defensive policy before changing.,
MW-BING-AI-CITED-URLS-CANONICAL-INDEXABILITY-QA-013E7,https://www.matchwalls.com/en/pages/professional-form,1,EN,page,200,https://www.matchwalls.com/en/pages/professional-form,text/html; charset=utf-8,en,Professional Account – Form,"Apply for your professional account and gain access to discounts, benefits, and exclusive services. Join MatchWalls.",1,Professional form,https://www.matchwalls.com/en/pages/professional-form,True,,,False,8,"x-default,es,pt,fr,de,it,en,nl",True,allow,/*/pages/,VERIFICADO Y CORRECTO,VERIFICADO PERO MEJORABLE,Potentially strategic citable content.,
MW-BING-AI-CITED-URLS-CANONICAL-INDEXABILITY-QA-013E7,https://www.matchwalls.com/en/collections/,1,EN,collection_index,200,https://www.matchwalls.com/en/collections/,text/html; charset=utf-8,en,Collections,"Custom and personalized wallpapers and murals, perfect for your project in self-adhesive vinyl. Unique designs, free international shipping.",1,All collections,https://www.matchwalls.com/en/collections,True,,,False,8,"x-default,es,pt,fr,de,it,en,nl",True,allow,/*/collections/,VERIFICADO Y CORRECTO,RIESGO CRITICO,Generic collections root cited by AI; audit why it is indexable/cited.,
MW-BING-AI-CITED-URLS-CANONICAL-INDEXABILITY-QA-013E7,https://www.matchwalls.com/pages/medidas-paredes,1,ES/default,page,200,https://www.matchwalls.com/pages/medidas-paredes,text/html; charset=utf-8,es,Cómo tomar las medidas de paredes - MatchWalls,Aprende a cómo medir tus paredes correctamente para un ajuste perfecto del papel pintado.,1,Cómo tomar medidas de paredes,https://www.matchwalls.com/pages/medidas-paredes,True,,,False,8,"x-default,es,pt,fr,de,it,en,nl",True,allow,/pages/,VERIFICADO Y CORRECTO,VERIFICADO PERO MEJORABLE,Potentially strategic citable content.,
MW-BING-AI-CITED-URLS-CANONICAL-INDEXABILITY-QA-013E7,https://www.matchwalls.com/products/gingham-charm-rosa,1,ES/default,product,200,https://www.matchwalls.com/products/gingham-charm-rosa,text/html; charset=utf-8,es,Papel Pintado Gingham Charm Rosa,"Descubre nuestro papel pintado Gingham Charm en tono rosa. Una amplia variedad de diseños en calidades non woven, autoadhesivo y vinílico.",1,Gingham Charm Rosa,https://www.matchwalls.com/products/gingham-charm-rosa,True,,,False,8,"x-default,es,pt,fr,de,it,en,nl",True,allow,/products/,VERIFICADO Y CORRECTO,VERIFICADO PERO MEJORABLE,Commercial product citation; validate product page quality if prioritised.,
