grupo,cantidad,estado,riesgo,motivo,recomendacion,lote_siguiente
test_url,1,INCORRECTO,Alto,"URL de prueba sin valor; redirect a home no es equivalente semantico","Eliminar redirect o dejar 404 si no existe sustituto exacto; no mezclar con otros cambios","MW-INDEXABILITY-REDIRECTS-HOME-TARGET-CLEANUP-011G5A"
coleccion_es_art_lienzo,4,REQUIERE DECISION HUMANA,Medio,"Colecciones ES antiguas de lienzos/cuadros apuntan a home; no se demostro coleccion actual equivalente","Decidir si lienzos/cuadros siguen siendo linea comercial. Si no, eliminar redirects; si si, crear o elegir URL canonica exacta antes de repuntar","MW-INDEXABILITY-REDIRECTS-HOME-TARGET-ES-ART-DECISION-011G5B"
legacy_no_product,21,STANDBY,Medio,"Productos legacy en noruego; locale no esta publicado y queda fuera de idiomas prioritarios","No tocar dentro de prioridad ES/EN/FR/DE/NL. Si Daniel autoriza limpieza de NO, auditar backlinks/GSC o eliminar por bloque pequeno","MW-INDEXABILITY-REDIRECTS-HOME-TARGET-NO-STANDBY-011G5C"
legacy_no_page,5,STANDBY,Medio,"Paginas legacy en noruego; locale no esta publicado y queda fuera de idiomas prioritarios","No tocar dentro de prioridad ES/EN/FR/DE/NL. Si Daniel autoriza limpieza de NO, decidir eliminar o repuntar a pagina equivalente prioritaria","MW-INDEXABILITY-REDIRECTS-HOME-TARGET-NO-STANDBY-011G5C"
legacy_no_collection,5,STANDBY,Medio,"Colecciones legacy en noruego; locale no esta publicado y varias pertenecen a artprints/matchwallsmurals legacy","No tocar por ahora; se solapa con politica legacy y no prioritarios","MW-INDEXABILITY-REDIRECTS-HOME-TARGET-NO-STANDBY-011G5C"
