lote,idioma,collection_cards,total_collection_links,unique_collection_links,ejemplos_deuda_heredada,estado
MW-COLLECTIONS-ROOT-HUB-I18N-DRAFT-FINAL-QA-013E13D,ES,48,192,107,"Sin deuda lingüística crítica detectada en muestra rápida",VERIFICADO Y CORRECTO
MW-COLLECTIONS-ROOT-HUB-I18N-DRAFT-FINAL-QA-013E13D,EN,48,192,108,"Algunos handles heredados mantienen matchwallsmurals y frases antiguas; no bloquea 013E13D",VERIFICADO PERO MEJORABLE
MW-COLLECTIONS-ROOT-HUB-I18N-DRAFT-FINAL-QA-013E13D,FR,48,192,105,"Nouveaux mortels; Le plus vendu; varios handles heredados matchwallsmurals",VERIFICADO PERO MEJORABLE
MW-COLLECTIONS-ROOT-HUB-I18N-DRAFT-FINAL-QA-013E13D,DE,48,192,103,"Bestverkauf; Versicherte Eleganz; varios handles heredados matchwallsmurals",VERIFICADO PERO MEJORABLE
MW-COLLECTIONS-ROOT-HUB-I18N-DRAFT-FINAL-QA-013E13D,NL,48,192,103,"Best verkopen; Nieuwe matchwalls; varios handles heredados matchwallsmurals",VERIFICADO PERO MEJORABLE
