"label","requested_url","final_uri","accept_language","status","html_lang","title","meta_description","meta_len","meta_equals_012j3","canonical","cf_cache_status"
"DE_default","https://www.matchwalls.com/de/pages/spanien-tapete?mwqa=012j4a-al-de-default-20260704022921","https://www.matchwalls.com/de/pages/spanien-tapete?mwqa=012j4a-al-de-default-20260704022921","","200","de","Tapeten in Spanien für Wohnräume und gewerbliche Projekte","Tapeten, Wandbilder und maßgefertigte Lösungen in Spanien MatchWalls gestaltet Tapeten, dekorative Wandbilder und maßgefertigte Wandlösungen für Wohnräume, Hotels, Restaurants, Büros, Ladengeschäfte und gewerbliche Räume in Spanien. Sie können zeitgenössische, botanische, künstlerische, geometrische, florale oder kindg","320","False","https://www.matchwalls.com/de/pages/spanien-tapete","DYNAMIC"
"DE_locale","https://www.matchwalls.com/de/pages/spanien-tapete?mwqa=012j4a-al-de-locale-20260704022921","https://www.matchwalls.com/de/pages/spanien-tapete?mwqa=012j4a-al-de-locale-20260704022921","de-DE,de;q=0.9,en;q=0.7","200","de","Tapeten in Spanien für Wohnräume und gewerbliche Projekte","Tapeten, Wandbilder und maßgefertigte Lösungen in Spanien MatchWalls gestaltet Tapeten, dekorative Wandbilder und maßgefertigte Wandlösungen für Wohnräume, Hotels, Restaurants, Büros, Ladengeschäfte und gewerbliche Räume in Spanien. Sie können zeitgenössische, botanische, künstlerische, geometrische, florale oder kindg","320","False","https://www.matchwalls.com/de/pages/spanien-tapete","DYNAMIC"
"NL_default","https://www.matchwalls.com/nl/pages/spanje-behang?mwqa=012j4a-al-nl-default-20260704022921","https://www.matchwalls.com/nl/pages/spanje-behang?mwqa=012j4a-al-nl-default-20260704022921","","200","nl","Behang in Spanje voor woningen en professionele projecten","Papel pintado, murales y soluciones a medida para viviendas y proyectos profesionales en España. Pide muestras y personaliza tu mural.","134","True","https://www.matchwalls.com/nl/pages/spanje-behang","DYNAMIC"
"NL_locale","https://www.matchwalls.com/nl/pages/spanje-behang?mwqa=012j4a-al-nl-locale-20260704022921","https://www.matchwalls.com/nl/pages/spanje-behang?mwqa=012j4a-al-nl-locale-20260704022921","nl-NL,nl;q=0.9,en;q=0.7","200","nl","Behang in Spanje voor woningen en professionele projecten","Behang, wanddecoratie en maatwerkoplossingen in Spanje MatchWalls ontwerpt behang, decoratieve wandoplossingen en maatwerk voor woningen, hotels, restaurants, kantoren, winkels en professionele ruimtes in Spanje. U kunt eigentijdse, botanische, artistieke, geometrische, florale of kindvriendelijke ontwerpen ontdekken e","320","False","https://www.matchwalls.com/nl/pages/spanje-behang","DYNAMIC"
"FR_locale","https://www.matchwalls.com/fr/pages/papier-peint-en-espagne?mwqa=012j4a-al-fr-locale-20260704022921","https://www.matchwalls.com/fr/pages/papier-peint-en-espagne?mwqa=012j4a-al-fr-locale-20260704022921","fr-FR,fr;q=0.9,en;q=0.7","200","fr","Papier peint en Espagne pour intérieurs résidentiels et projets profes","Papiers peints, panoramiques et solutions sur mesure en Espagne Chez MatchWalls, nous concevons des papiers peints, des panoramiques décoratifs et des solutions murales sur mesure pour les intérieurs résidentiels, hôtels, restaurants, bureaux, boutiques et espaces professionnels en Espagne. Vous pouvez explorer des des","320","False","https://www.matchwalls.com/fr/pages/papier-peint-en-espagne","DYNAMIC"
"EN_locale","https://www.matchwalls.com/en/pages/spain-wallpaper?mwqa=012j4a-al-en-locale-20260704022921","https://www.matchwalls.com/en/pages/spain-wallpaper?mwqa=012j4a-al-en-locale-20260704022921","en-US,en;q=0.9","200","en","Wallpaper in Spain for homes and professional projects","Wallpaper, murals and made-to-measure solutions in Spain At MatchWalls, we design wallpaper, decorative wall murals and made-to-measure wall solutions for homes, hotels, restaurants, offices, retail spaces and professional interiors in Spain. You can explore contemporary, botanical, artistic, geometric, floral or child","320","False","https://www.matchwalls.com/en/pages/spain-wallpaper","DYNAMIC"
