requested_url,final_url,status,canonical,robots,title,h1,estado,nota
https://www.matchwalls.com/collections/murales,https://www.matchwalls.com/collections/murales,200,https://www.matchwalls.com/collections/murales,,Todos los Papeles Pintados y Murales - Diseños modernos,Todos los Papeles Pintados,CORREGIDO Y VERIFICADO,"200 directo; ya no depende del redirect Admin eliminado"
https://www.matchwalls.com/en/collections/all-matchwallsmurals-murals,https://www.matchwalls.com/en/collections/all-matchwallsmurals-murals,200,https://www.matchwalls.com/en/collections/all-matchwallsmurals-murals,,All Wallpapers and Murals for Wall - MatchWalls,All Wallpaper,VERIFICADO Y CORRECTO,"Handle EN localizado sigue vivo"
https://www.matchwalls.com/fr/collections/tous-les-peintures-murales-matchwallsmurals,https://www.matchwalls.com/fr/collections/tous-les-peintures-murales-matchwallsmurals,200,https://www.matchwalls.com/fr/collections/tous-les-peintures-murales-matchwallsmurals,,Tous les Papiers Peints et Fresques Murales - Designs Modernes,Tous les Papiers Peints,VERIFICADO Y CORRECTO,"Handle FR localizado sigue vivo"
https://www.matchwalls.com/de/collections/alle-matchwallsmurals-wandbilder,https://www.matchwalls.com/de/collections/alle-matchwallsmurals-wandbilder,200,https://www.matchwalls.com/de/collections/alle-matchwallsmurals-wandbilder,,Alle Tapeten und Wandbilder - Moderne Designs,Alle Tapeten,VERIFICADO Y CORRECTO,"Handle DE localizado verificado en reintento"
https://www.matchwalls.com/nl/collections/alle-matchwallsmurals-muurschilderingen,https://www.matchwalls.com/nl/collections/alle-matchwallsmurals-muurschilderingen,200,https://www.matchwalls.com/nl/collections/alle-matchwallsmurals-muurschilderingen,,Alle Behang en Muurschilderingen - Moderne Ontwerpen,Alle Behang,VERIFICADO Y CORRECTO,"Handle NL localizado sigue vivo"
https://www.matchwalls.com/collections/papeles-pintados-old,https://www.matchwalls.com/collections/murales,200,https://www.matchwalls.com/collections/murales,,Todos los Papeles Pintados y Murales - Diseños modernos,Todos los Papeles Pintados,VERIFICADO PERO MEJORABLE,"Legacy conservado; 301 hacia /collections/murales"
https://www.matchwalls.com/collections/papeles-pintados,https://www.matchwalls.com/collections/murales,200,https://www.matchwalls.com/collections/murales,,Todos los Papeles Pintados y Murales - Diseños modernos,Todos los Papeles Pintados,VERIFICADO PERO MEJORABLE,"Aún conserva cadena por /collections/papeles-pintados-old; pendiente 011F5"
