"lang","requested_url","status","title","meta_description","meta_len","og_description","twitter_description","meta_equals_012j3","og_equals_012j3","twitter_equals_012j3","canonical","noindex","cf_cache_status"
"ES","https://www.matchwalls.com/pages/papel-pintado-espana?mwqa=012j4a-es-20260704022242","200","Papel pintado en España para hogares y proyectos profesionales","Papel pintado, murales y soluciones a medida para viviendas y proyectos profesionales en España. Pide muestras y personaliza tu mural.","134","Papel pintado, murales y soluciones a medida para viviendas y proyectos profesionales en España. Pide muestras y personaliza tu mural.","Papel pintado, murales y soluciones a medida para viviendas y proyectos profesionales en España. Pide muestras y personaliza tu mural.","True","True","True","https://www.matchwalls.com/pages/papel-pintado-espana","False","DYNAMIC"
"DE","https://www.matchwalls.com/de/pages/spanien-tapete?mwqa=012j4a-de-20260704022242","200","Tapeten in Spanien für Wohnräume und gewerbliche Projekte","Papel pintado, murales y soluciones a medida para viviendas y proyectos profesionales en España. Pide muestras y personaliza tu mural.","134","Papel pintado, murales y soluciones a medida para viviendas y proyectos profesionales en España. Pide muestras y personaliza tu mural.","Papel pintado, murales y soluciones a medida para viviendas y proyectos profesionales en España. Pide muestras y personaliza tu mural.","True","True","True","https://www.matchwalls.com/de/pages/spanien-tapete","False","DYNAMIC"
"NL","https://www.matchwalls.com/nl/pages/spanje-behang?mwqa=012j4a-nl-20260704022242","200","Behang in Spanje voor woningen en professionele projecten","Behang, wanddecoratie en maatwerkoplossingen in Spanje MatchWalls ontwerpt behang, decoratieve wandoplossingen en maatwerk voor woningen, hotels, restaurants, kantoren, winkels en professionele ruimtes in Spanje. U kunt eigentijdse, botanische, artistieke, geometrische, florale of kindvriendelijke ontwerpen ontdekken e","320","Behang, wanddecoratie en maatwerkoplossingen in Spanje MatchWalls ontwerpt behang, decoratieve wandoplossingen en maatwerk voor woningen, hotels, restaurants, kantoren, winkels en professionele ruimtes in Spanje. U kunt eigentijdse, botanische, artistieke, geometrische, florale of kindvriendelijke ontwerpen ontdekken e","Behang, wanddecoratie en maatwerkoplossingen in Spanje MatchWalls ontwerpt behang, decoratieve wandoplossingen en maatwerk voor woningen, hotels, restaurants, kantoren, winkels en professionele ruimtes in Spanje. U kunt eigentijdse, botanische, artistieke, geometrische, florale of kindvriendelijke ontwerpen ontdekken e","False","False","False","https://www.matchwalls.com/nl/pages/spanje-behang","False","DYNAMIC"
"FR","https://www.matchwalls.com/fr/pages/papier-peint-en-espagne?mwqa=012j4a-fr-20260704022242","200","Papier peint en Espagne pour intérieurs résidentiels et projets profes","Papiers peints, panoramiques et solutions sur mesure en Espagne Chez MatchWalls, nous concevons des papiers peints, des panoramiques décoratifs et des solutions murales sur mesure pour les intérieurs résidentiels, hôtels, restaurants, bureaux, boutiques et espaces professionnels en Espagne. Vous pouvez explorer des des","320","Papiers peints, panoramiques et solutions sur mesure en Espagne Chez MatchWalls, nous concevons des papiers peints, des panoramiques décoratifs et des solutions murales sur mesure pour les intérieurs résidentiels, hôtels, restaurants, bureaux, boutiques et espaces professionnels en Espagne. Vous pouvez explorer des des","Papiers peints, panoramiques et solutions sur mesure en Espagne Chez MatchWalls, nous concevons des papiers peints, des panoramiques décoratifs et des solutions murales sur mesure pour les intérieurs résidentiels, hôtels, restaurants, bureaux, boutiques et espaces professionnels en Espagne. Vous pouvez explorer des des","False","False","False","https://www.matchwalls.com/fr/pages/papier-peint-en-espagne","False","DYNAMIC"
"EN","https://www.matchwalls.com/en/pages/spain-wallpaper?mwqa=012j4a-en-20260704022242","200","Wallpaper in Spain for homes and professional projects","Wallpaper, murals and made-to-measure solutions in Spain At MatchWalls, we design wallpaper, decorative wall murals and made-to-measure wall solutions for homes, hotels, restaurants, offices, retail spaces and professional interiors in Spain. You can explore contemporary, botanical, artistic, geometric, floral or child","320","Wallpaper, murals and made-to-measure solutions in Spain At MatchWalls, we design wallpaper, decorative wall murals and made-to-measure wall solutions for homes, hotels, restaurants, offices, retail spaces and professional interiors in Spain. You can explore contemporary, botanical, artistic, geometric, floral or child","Wallpaper, murals and made-to-measure solutions in Spain At MatchWalls, we design wallpaper, decorative wall murals and made-to-measure wall solutions for homes, hotels, restaurants, offices, retail spaces and professional interiors in Spain. You can explore contemporary, botanical, artistic, geometric, floral or child","False","False","False","https://www.matchwalls.com/en/pages/spain-wallpaper","False","DYNAMIC"
