lang,requested_url,status,title,meta_description,meta_len,meta_equals_previous_value,canonical,h1,hreflang_count,noindex,status_lote,nota
"ES","https://www.matchwalls.com/pages/papel-pintado-espana?mwqa=012j3-rollback-es","200","Papel pintado en España para hogares y proyectos profesionales","Papel pintado, murales y soluciones a medida para viviendas y proyectos profesionales en España. Pide muestras y personaliza tu mural.","134","true","https://www.matchwalls.com/pages/papel-pintado-espana","Papel pintado en España para hogares y proyectos profesionales","8","false","INCORRECTO","Tras rollback declarado, la meta publica ES sigue mostrando el valor del piloto."
"FR","https://www.matchwalls.com/fr/pages/papier-peint-en-espagne?mwqa=012j3-rollback-fr","200","Papier peint en Espagne pour intérieurs résidentiels et projets profes","Papiers peints, panoramiques et solutions sur mesure en Espagne Chez MatchWalls, nous concevons des papiers peints, des panoramiques décoratifs et des solutions murales sur mesure pour les intérieurs résidentiels, hôtels, restaurants, bureaux, boutiques et espaces professionnels en Espagne. Vous pouvez explorer des des","320","false","https://www.matchwalls.com/fr/pages/papier-peint-en-espagne","Papier peint en Espagne pour intérieurs résidentiels et projets professionnels","8","false","VERIFICADO PERO MEJORABLE","FR no muestra la meta ES; mantiene descripcion autogenerada en frances."
"EN","https://www.matchwalls.com/en/pages/spain-wallpaper?mwqa=012j3-rollback-en","200","Wallpaper in Spain for homes and professional projects","Wallpaper, murals and made-to-measure solutions in Spain At MatchWalls, we design wallpaper, decorative wall murals and made-to-measure wall solutions for homes, hotels, restaurants, offices, retail spaces and professional interiors in Spain. You can explore contemporary, botanical, artistic, geometric, floral or child","320","false","https://www.matchwalls.com/en/pages/spain-wallpaper","Wallpaper in Spain for homes and professional projects","8","false","VERIFICADO PERO MEJORABLE","EN no muestra la meta ES; mantiene descripcion autogenerada en ingles."
"DE","https://www.matchwalls.com/de/pages/spanien-tapete?mwqa=012j3-rollback-de","200","Tapeten in Spanien für Wohnräume und gewerbliche Projekte","Papel pintado, murales y soluciones a medida para viviendas y proyectos profesionales en España. Pide muestras y personaliza tu mural.","134","true","https://www.matchwalls.com/de/pages/spanien-tapete","Tapeten in Spanien für Wohnräume und gewerbliche Projekte","8","false","INCORRECTO","Tras rollback declarado, DE sigue heredando la meta ES del piloto."
"NL","https://www.matchwalls.com/nl/pages/spanje-behang?mwqa=012j3-rollback-nl","200","Behang in Spanje voor woningen en professionele projecten","Behang, wanddecoratie en maatwerkoplossingen in Spanje MatchWalls ontwerpt behang, decoratieve wandoplossingen en maatwerk voor woningen, hotels, restaurants, kantoren, winkels en professionele ruimtes in Spanje. U kunt eigentijdse, botanische, artistieke, geometrische, florale of kindvriendelijke ontwerpen ontdekken e","320","false","https://www.matchwalls.com/nl/pages/spanje-behang","Behang in Spanje voor woningen en professionele projecten","8","false","VERIFICADO PERO MEJORABLE","NL ya no muestra la meta ES; vuelve a descripcion autogenerada en neerlandes."
