page,lang,url,status,noindex,canonical,heading_present,target_href_present,anchor_present,result,context,cf_cache,server
Spain,ES,https://www.matchwalls.com/pages/papel-pintado-espana,200,False,,False,False,False,FAIL,"Ciudades y zonas estratégicas Si buscas papel pintado en Barcelona, Madrid, Valencia, Málaga, Sevilla, Girona, Tarragona, Bizkaia, Gipuzkoa, Granada, Murcia o Zaragoza, MatchWalls puede servir como punto de partida para elegir diseño, material y muestra antes de avanzar con tu proyecto. Preguntas frecuentes ¿Puedo pedir muestras antes de comprar? S",,
Spain,EN,https://www.matchwalls.com/en/pages/spain-wallpaper,200,False,,False,False,False,FAIL,"Strategic cities and areas If your project is in Barcelona, Madrid, Valencia, Málaga, Sevilla, Girona, Tarragona, Bizkaia, Gipuzkoa, Granada, Murcia or Zaragoza, MatchWalls can be a starting point for choosing the right design, material and samples before moving forward. Frequently asked questions Can I order samples before buying? Yes. Samples hel",,
Spain,FR,https://www.matchwalls.com/fr/pages/papier-peint-en-espagne,200,False,,False,False,False,FAIL,"Villes et zones stratégiques Si votre projet concerne Barcelona, Madrid, Valencia, Málaga, Sevilla, Girona, Tarragona, Bizkaia, Gipuzkoa, Granada, Murcia ou Zaragoza, MatchWalls peut servir de point de départ pour choisir un design, un matériau et des échantillons avant d’avancer. Questions fréquentes Puis-je commander des échantillons avant d’ache",,
Spain,DE,https://www.matchwalls.com/de/pages/spanien-tapete,200,False,,False,False,False,FAIL,"Strategische Städte und Regionen Wenn Ihr Projekt Barcelona, Madrid, Valencia, Málaga, Sevilla, Girona, Tarragona, Bizkaia, Gipuzkoa, Granada, Murcia oder Zaragoza betrifft, kann MatchWalls ein Ausgangspunkt sein, um Design, Material und Muster vor dem nächsten Schritt auszuwählen. Häufige Fragen Kann ich vor dem Kauf Muster bestellen? Ja. Muster h",,
Spain,NL,https://www.matchwalls.com/nl/pages/spanje-behang,200,False,,False,False,False,FAIL,"Strategische steden en regio’s Als uw project zich richt op Barcelona, Madrid, Valencia, Málaga, Sevilla, Girona, Tarragona, Bizkaia, Gipuzkoa, Granada, Murcia of Zaragoza, kan MatchWalls een startpunt zijn om ontwerp, materiaal en monsters te kiezen voordat u verdergaat. Veelgestelde vragen Kan ik monsters bestellen voordat ik koop? Ja. Monsters h",,
France,ES,https://www.matchwalls.com/pages/papel-pintado-francia,200,False,,False,False,False,FAIL,"Ciudades estratégicas en Francia Si buscas papel pintado en París, Lyon, Toulouse, Marsella, Burdeos, Nantes, Lille, Niza, Montpellier o Estrasburgo, MatchWalls puede servir como punto de partida para elegir diseño, material y muestras antes de lanzar tu proyecto. Preguntas frecuentes ¿Puedo pedir muestras antes de comprar? Sí. Las muestras permite",,
France,EN,https://www.matchwalls.com/en/pages/french-wallpaper,200,False,,False,False,False,FAIL,"Strategic cities in France If you are looking for wallpaper in Paris, Lyon, Toulouse, Marseille, Bordeaux, Nantes, Lille, Nice, Montpellier or Strasbourg, MatchWalls can be a starting point for choosing the right design, material and samples before launching your project. Frequently asked questions Can I order samples before buying? Yes. Samples al",,
France,FR,https://www.matchwalls.com/fr/pages/papier-peint-en-france,200,False,,False,False,False,FAIL,"Villes stratégiques en France Si vous recherchez du papier peint à Paris, Lyon, Toulouse, Marseille, Bordeaux, Nantes, Lille, Nice, Montpellier ou Strasbourg, MatchWalls peut servir de point de départ pour choisir un design, un matériau et des échantillons avant de lancer votre projet. Questions fréquentes Puis-je commander des échantillons avant d",,
France,DE,https://www.matchwalls.com/de/pages/franzosische-tapete,200,False,,False,False,False,FAIL,"Strategische Städte in Frankreich Wenn Sie Tapeten für Paris, Lyon, Toulouse, Marseille, Bordeaux, Nantes, Lille, Nice, Montpellier oder Strasbourg suchen, kann MatchWalls ein Ausgangspunkt sein, um Design, Material und Muster vor dem Projektstart auszuwählen. Häufige Fragen Kann ich vor dem Kauf Muster bestellen? Ja. Muster helfen dabei, Farbe, Te",,
France,NL,https://www.matchwalls.com/nl/pages/frans-behang,200,False,,False,False,False,FAIL,"Strategische steden in Frankrijk Als u behang zoekt voor Paris, Lyon, Toulouse, Marseille, Bordeaux, Nantes, Lille, Nice, Montpellier of Strasbourg, kan MatchWalls een startpunt zijn om ontwerp, materiaal en monsters te kiezen voordat u uw project start. Veelgestelde vragen Kan ik monsters bestellen voordat ik koop? Ja. Monsters helpen om kleur, te",,
